{"primary_intent":"generate","brief_class":"concept_to_production","execution_status":"not_executed","workflow_steps":[{"id":"intake_brief","objective":"Confirm brand goals, target pet owners, sales channels, markets, SKU count, pack formats, commercial constraints, responsibilities, approval gates, success criteria and missing inputs."},{"id":"research","objective":"Investigate the category, customer and retailer needs, competitive packaging conventions, shelf and digital viewing conditions, and applicable pet-food labeling requirements without deriving a style from the reference."},{"id":"principles","objective":"Establish positioning, brand personality, accessibility, information-hierarchy, portfolio-coherence and SKU-differentiation principles that can guide objective evaluation."},{"id":"structure_spec","objective":"Define each pouch's dimensions, fill weight, panels, seal and safe zones, opening features, content architecture, barcode area and required front-, back- and side-panel information."},{"id":"dieline","objective":"Create or reconcile converter-approved pouch artwork geometry, including trim, seals, gussets, notches, registration marks, bleeds and safe areas."},{"id":"explore_concepts","objective":"Develop meaningfully different identity and hero-pouch directions covering naming presentation, logo, typography, colour, imagery, hierarchy and family logic."},{"id":"select_direction","objective":"Compare directions against the agreed principles, feasibility and category needs, then obtain explicit client selection and document accepted decisions."},{"id":"prototype_test","objective":"Produce actual-size rough prints and representative pouch prototypes to test recognition, hierarchy, legibility, variant distinction, handling and compatibility with structural constraints."},{"id":"refine","objective":"Apply consolidated client, user, regulatory and prototype feedback to the selected direction while preserving approved strategic decisions."},{"id":"identity_system","objective":"Codify the approved logo suite, typography, colour, image language, graphic elements, accessibility rules and governance needed for consistent packaging use."},{"id":"expand_assets","objective":"Roll the approved master design across the complete pouch range using a controlled SKU matrix for flavours, recipes, life stages, sizes and mandatory content."},{"id":"production_file","objective":"Prepare separated, print-ready masters with correct colour spaces, inks, bleeds, trapping guidance, linked assets, fonts, barcodes, technical layers and converter-specific preflight checks."}],"reference_observations":[{"asset_id":"BRF-PACK-05-reference-1","observations":["The image presents a centrally stacked family of food packages against a very dark brown-black background.","Several rectangular cartons and multiple capped flexible pouches are visible, showing a branded family applied across more than one package format.","The words “Rich Cheese” recur prominently across the packages, accompanied by a repeated small red-and-white circular emblem and additional Chinese-script text.","Cream, white, pale blue, yellow, green and pink package fields distinguish visible variants while repeated typography and emblem placement connect the family.","Photographic ingredient cues are visible on different packs, including cheese pieces, strawberries and dark berries.","Small statements appear in the upper corners of the composition, while the packages overlap at different scales to form a compact product-family presentation.","The low-resolution published outcome demonstrates repetition and variation across a packaging family, but it does not reveal source artwork, dielines, manufacturing specifications or process decisions."]}],"deliverable_concepts":["brand_strategy","logo_system","visual_identity","packaging_family","sku_differentiation","production_spec","mockups","dieline","prototype"],"missing_inputs":["Approved brand name, trademark status, existing identity assets and clarification of whether the identity is net-new or a refresh","Business objective, positioning, differentiators, brand personality and measurable success criteria","Target pet species, owner segments, price tier, sales channels, launch markets and languages","Complete SKU matrix, including recipes, flavours, life stages, sizes, fill weights and launch priorities","Final product facts and approved copy, including ingredients, nutritional or guaranteed analysis, feeding guidance, warnings, claims, manufacturer details and country-of-origin information","Applicable market-specific pet-food labeling, retailer and accessibility requirements, plus the designated legal or regulatory approver","Pouch construction details, dimensions, material and barrier requirements, filling and sealing method, opening features, retort or other processing conditions, and sustainability constraints","Converter-approved dielines, print method, substrate, ink and colour limitations, minimum type and line weights, tolerances, finishes and proofing requirements","Assigned and verified barcodes, recycling marks, certification marks and evidence supporting every claim","Approved photography or illustration approach, source assets, usage rights and responsibility for commissioning new imagery","Budget, schedule, review stakeholders, decision owner, revision allowance, quantities and handoff requirements"],"assumptions":["The requested work is an end-to-end concept-to-production engagement covering identity creation and a coordinated multi-SKU pouch family.","More than one wet-food SKU is intended, but the number and differentiation dimensions remain unknown.","A common master architecture will connect the range while controlled colour, naming and/or imagery cues distinguish SKUs.","Pouch engineering and food-contact compliance will require approval from the converter or qualified packaging specialist; the designer will not independently certify manufacturing fitness.","The client will supply or formally approve product data, regulatory copy, claims substantiation, barcodes and legal translations.","Final delivery means validated digital identity and packaging assets; printing, filling and commercial manufacture are performed by appointed vendors.","The reference is treated only as visible published-outcome evidence of a coordinated packaging family and will not determine the pet-food brand's aesthetic, content or structure."],"stop_conditions":["Do not begin substantive concept exploration until brand ownership, audience, positioning, launch market and initial SKU scope are confirmed.","Do not finalize pouch layouts without confirmed dimensions, construction, processing requirements and converter-approved technical geometry.","Do not expand the selected design across the range without explicit written direction approval and a controlled SKU-content matrix.","Do not release production files until all mandatory pet-food copy, translations, claims and regulatory content have been approved by the responsible client or specialist.","Stop production release if prototypes or proofs reveal inadequate legibility, weak SKU distinction, seal-zone conflicts, barcode failure, colour problems or material and processing incompatibility.","Do not deliver final masters while barcodes, licenses, linked assets, fonts, proof approvals or converter preflight acceptance remain unresolved.","Re-scope before proceeding if approved structure, SKU count, markets, print method or core brand direction changes materially."],"rationale":"The brief is classified as concept_to_production because it spans strategy and identity creation, packaging architecture, multi-SKU rollout, physical validation, production preparation and final handoff. The published reference supports only the observable idea of a coherent package family using repeated brand elements and visible variation; it supplies no pet-food strategy, aesthetic mandate, dieline or manufacturing evidence.","confidence":0.94}